{
  "$schema": "https://json-schema.org/draft/2020-12/schema",
  "$id": "https://xander-deane.dev/schemas/interaction-event.schema.json",
  "title": "InteractionEvent",
  "description": "Append-only event generated by the learner, AI tutor, or workspace UI.",
  "type": "object",
  "required": [
    "contractVersion",
    "id",
    "sessionId",
    "problemId",
    "type",
    "occurredAt",
    "modality",
    "payload"
  ],
  "additionalProperties": false,
  "properties": {
    "contractVersion": {
      "type": "string",
      "minLength": 1
    },
    "id": {
      "type": "string",
      "minLength": 1
    },
    "sessionId": {
      "type": "string",
      "minLength": 1
    },
    "learnerId": {
      "type": [
        "string",
        "null"
      ]
    },
    "problemId": {
      "type": "string",
      "minLength": 1
    },
    "type": {
      "type": "string",
      "enum": [
        "problem_presented",
        "user_typed",
        "user_spoke",
        "user_drew",
        "user_dragged",
        "user_tapped",
        "user_selected",
        "ai_message_shown",
        "ai_spoke",
        "ai_highlighted",
        "answer_checked",
        "hint_requested",
        "tool_changed",
        "workspace_reset"
      ]
    },
    "occurredAt": {
      "type": "string",
      "format": "date-time"
    },
    "modality": {
      "type": "string",
      "enum": [
        "text",
        "audio",
        "video",
        "drawing",
        "touch",
        "gesture",
        "manipulative",
        "camera"
      ]
    },
    "payload": {
      "type": "object",
      "additionalProperties": true
    },
    "trace": {
      "type": "object",
      "additionalProperties": true,
      "default": {}
    }
  }
}
